<?xml version="1.0" encoding="UTF-8"?>
<cifp
 xmlns:xsi="http://www.w3.org/2001/XMLSchema-instance" 
 xsi:noNamespaceSchemaLocation="cifp.xsd">

<alumne alumne_id="1">
  <nom></nom>
    <llinatges></llinatges>
      <data_naixement></data_naixement>
      <correu></correu>
      <telefon></telefon>
      <adreça></adreça>
      <data_matricula></data_matricula>
      <curs></curs>
</alumne>
    
<professor professor_id="2">
    <nom></nom>
    <llinatges></llinatges>
      <data_naixement></data_naixement>
      <correu></correu>
      <telefon></telefon>
      <adreça></adreça>
      <data_incorporacio></data_incorporacio>
      <departament tipus="INFORMATICA"></departament>
      
<assignatura assignatura_id="3"> <!--OJO EN XML-XSD CAMBIADO A NUMERO (NO ALUMN1) PORQUE COMO ES TIPO INTEGER NO LO VALIDABA-->
          <nom_assignatura cicle="DAW"></nom_assignatura>
          <data_inici></data_inici>
          <data_final></data_final>
</assignatura>
</professor>

</cifp>